{
  "schemaVersion": 1,
  "verifiedAt": "2026-10-16",
  "source": "https://umamusume.jp/character",
  "officialCharacters": [
    {
      "characterId": "special-week",
      "officialId": "specialweek",
      "kind": "main",
      "nameJa": "スペシャルウィーク",
      "nameEn": "Special Week",
      "voiceJa": "和氣あず未",
      "source": "https://umamusume.jp/character/specialweek"
    },
    {
      "characterId": "silence-suzuka",
      "officialId": "silencesuzuka",
      "kind": "main",
      "nameJa": "サイレンススズカ",
      "nameEn": "Silence Suzuka",
      "voiceJa": "高野麻里佳",
      "source": "https://umamusume.jp/character/silencesuzuka"
    },
    {
      "characterId": "tokai-teio",
      "officialId": "tokaiteio",
      "kind": "main",
      "nameJa": "トウカイテイオー",
      "nameEn": "Tokai Teio",
      "voiceJa": "Machico",
      "source": "https://umamusume.jp/character/tokaiteio"
    },
    {
      "characterId": "maruzensky",
      "officialId": "maruzensky",
      "kind": "main",
      "nameJa": "マルゼンスキー",
      "nameEn": "Maruzensky",
      "voiceJa": "Lynn",
      "source": "https://umamusume.jp/character/maruzensky"
    },
    {
      "characterId": "fuji-kiseki",
      "officialId": "fujikiseki",
      "kind": "main",
      "nameJa": "フジキセキ",
      "nameEn": "Fuji Kiseki",
      "voiceJa": "松井恵理子",
      "source": "https://umamusume.jp/character/fujikiseki"
    },
    {
      "characterId": "oguri-cap",
      "officialId": "oguricap",
      "kind": "main",
      "nameJa": "オグリキャップ",
      "nameEn": "Oguri Cap",
      "voiceJa": "高柳知葉",
      "source": "https://umamusume.jp/character/oguricap"
    },
    {
      "characterId": "gold-ship",
      "officialId": "goldship",
      "kind": "main",
      "nameJa": "ゴールドシップ",
      "nameEn": "Gold Ship",
      "voiceJa": "上田瞳",
      "source": "https://umamusume.jp/character/goldship"
    },
    {
      "characterId": "vodka",
      "officialId": "vodka",
      "kind": "main",
      "nameJa": "ウオッカ",
      "nameEn": "Vodka",
      "voiceJa": "大橋彩香",
      "source": "https://umamusume.jp/character/vodka"
    },
    {
      "characterId": "daiwa-scarlet",
      "officialId": "daiwascarlet",
      "kind": "main",
      "nameJa": "ダイワスカーレット",
      "nameEn": "Daiwa Scarlet",
      "voiceJa": "木村千咲",
      "source": "https://umamusume.jp/character/daiwascarlet"
    },
    {
      "characterId": "taiki-shuttle",
      "officialId": "taikishuttle",
      "kind": "main",
      "nameJa": "タイキシャトル",
      "nameEn": "Taiki Shuttle",
      "voiceJa": "大坪由佳",
      "source": "https://umamusume.jp/character/taikishuttle"
    },
    {
      "characterId": "grass-wonder",
      "officialId": "grasswonder",
      "kind": "main",
      "nameJa": "グラスワンダー",
      "nameEn": "Grass Wonder",
      "voiceJa": "前田玲奈",
      "source": "https://umamusume.jp/character/grasswonder"
    },
    {
      "characterId": "hishi-amazon",
      "officialId": "hishiamazon",
      "kind": "main",
      "nameJa": "ヒシアマゾン",
      "nameEn": "Hishi Amazon",
      "voiceJa": "巽悠衣子",
      "source": "https://umamusume.jp/character/hishiamazon"
    },
    {
      "characterId": "mejiro-mcqueen",
      "officialId": "mejiromcqueen",
      "kind": "main",
      "nameJa": "メジロマックイーン",
      "nameEn": "Mejiro McQueen",
      "voiceJa": "大西沙織",
      "source": "https://umamusume.jp/character/mejiromcqueen"
    },
    {
      "characterId": "el-condor-pasa",
      "officialId": "elcondorpasa",
      "kind": "main",
      "nameJa": "エルコンドルパサー",
      "nameEn": "El Condor Pasa",
      "voiceJa": "髙橋ミナミ",
      "source": "https://umamusume.jp/character/elcondorpasa"
    },
    {
      "characterId": "t-m-opera-o",
      "officialId": "tmoperao",
      "kind": "main",
      "nameJa": "テイエムオペラオー",
      "nameEn": "T.M. Opera O",
      "voiceJa": "徳井青空",
      "source": "https://umamusume.jp/character/tmoperao"
    },
    {
      "characterId": "narita-brian",
      "officialId": "naritabrian",
      "kind": "main",
      "nameJa": "ナリタブライアン",
      "nameEn": "Narita Brian",
      "voiceJa": "衣川里佳",
      "source": "https://umamusume.jp/character/naritabrian"
    },
    {
      "characterId": "symboli-rudolf",
      "officialId": "symbolirudolf",
      "kind": "main",
      "nameJa": "シンボリルドルフ",
      "nameEn": "Symboli Rudolf",
      "voiceJa": "田所あずさ",
      "source": "https://umamusume.jp/character/symbolirudolf"
    },
    {
      "characterId": "air-groove",
      "officialId": "airgroove",
      "kind": "main",
      "nameJa": "エアグルーヴ",
      "nameEn": "Air Groove",
      "voiceJa": "青木瑠璃子",
      "source": "https://umamusume.jp/character/airgroove"
    },
    {
      "characterId": "agnes-digital",
      "officialId": "agnesdigital",
      "kind": "main",
      "nameJa": "アグネスデジタル",
      "nameEn": "Agnes Digital",
      "voiceJa": "鈴木みのり",
      "source": "https://umamusume.jp/character/agnesdigital"
    },
    {
      "characterId": "seiun-sky",
      "officialId": "seiunsky",
      "kind": "main",
      "nameJa": "セイウンスカイ",
      "nameEn": "Seiun Sky",
      "voiceJa": "鬼頭明里",
      "source": "https://umamusume.jp/character/seiunsky"
    },
    {
      "characterId": "tamamo-cross",
      "officialId": "tamamocross",
      "kind": "main",
      "nameJa": "タマモクロス",
      "nameEn": "Tamamo Cross",
      "voiceJa": "大空直美",
      "source": "https://umamusume.jp/character/tamamocross"
    },
    {
      "characterId": "fine-motion",
      "officialId": "finemotion",
      "kind": "main",
      "nameJa": "ファインモーション",
      "nameEn": "Fine Motion",
      "voiceJa": "橋本ちなみ",
      "source": "https://umamusume.jp/character/finemotion"
    },
    {
      "characterId": "biwa-hayahide",
      "officialId": "biwahayahide",
      "kind": "main",
      "nameJa": "ビワハヤヒデ",
      "nameEn": "Biwa Hayahide",
      "voiceJa": "近藤唯",
      "source": "https://umamusume.jp/character/biwahayahide"
    },
    {
      "characterId": "mayano-top-gun",
      "officialId": "mayanotopgun",
      "kind": "main",
      "nameJa": "マヤノトップガン",
      "nameEn": "Mayano Top Gun",
      "voiceJa": "星谷美緒",
      "source": "https://umamusume.jp/character/mayanotopgun"
    },
    {
      "characterId": "manhattan-cafe",
      "officialId": "manhattancafe",
      "kind": "main",
      "nameJa": "マンハッタンカフェ",
      "nameEn": "Manhattan Cafe",
      "voiceJa": "小倉唯",
      "source": "https://umamusume.jp/character/manhattancafe"
    },
    {
      "characterId": "mihono-bourbon",
      "officialId": "mihonobourbon",
      "kind": "main",
      "nameJa": "ミホノブルボン",
      "nameEn": "Mihono Bourbon",
      "voiceJa": "長谷川育美",
      "source": "https://umamusume.jp/character/mihonobourbon"
    },
    {
      "characterId": "mejiro-ryan",
      "officialId": "mejiroryan",
      "kind": "main",
      "nameJa": "メジロライアン",
      "nameEn": "Mejiro Ryan",
      "voiceJa": "土師亜文",
      "source": "https://umamusume.jp/character/mejiroryan"
    },
    {
      "characterId": "hishi-akebono",
      "officialId": "hishiakebono",
      "kind": "main",
      "nameJa": "ヒシアケボノ",
      "nameEn": "Hishi Akebono",
      "voiceJa": "松嵜麗",
      "source": "https://umamusume.jp/character/hishiakebono"
    },
    {
      "characterId": "yukino-bijin",
      "officialId": "yukinobijin",
      "kind": "main",
      "nameJa": "ユキノビジン",
      "nameEn": "Yukino Bijin",
      "voiceJa": "山本希望",
      "source": "https://umamusume.jp/character/yukinobijin"
    },
    {
      "characterId": "rice-shower",
      "officialId": "riceshower",
      "kind": "main",
      "nameJa": "ライスシャワー",
      "nameEn": "Rice Shower",
      "voiceJa": "石見舞菜香",
      "source": "https://umamusume.jp/character/riceshower"
    },
    {
      "characterId": "ines-fujin",
      "officialId": "inesfujin",
      "kind": "main",
      "nameJa": "アイネスフウジン",
      "nameEn": "Ines Fujin",
      "voiceJa": "長江里加",
      "source": "https://umamusume.jp/character/inesfujin"
    },
    {
      "characterId": "agnes-tachyon",
      "officialId": "agnestachyon",
      "kind": "main",
      "nameJa": "アグネスタキオン",
      "nameEn": "Agnes Tachyon",
      "voiceJa": "上坂すみれ",
      "source": "https://umamusume.jp/character/agnestachyon"
    },
    {
      "characterId": "admire-vega",
      "officialId": "admirevega",
      "kind": "main",
      "nameJa": "アドマイヤベガ",
      "nameEn": "Admire Vega",
      "voiceJa": "咲々木瞳",
      "source": "https://umamusume.jp/character/admirevega"
    },
    {
      "characterId": "inari-one",
      "officialId": "inarione",
      "kind": "main",
      "nameJa": "イナリワン",
      "nameEn": "Inari One",
      "voiceJa": "井上遥乃",
      "source": "https://umamusume.jp/character/inarione"
    },
    {
      "characterId": "winning-ticket",
      "officialId": "winningticket",
      "kind": "main",
      "nameJa": "ウイニングチケット",
      "nameEn": "Winning Ticket",
      "voiceJa": "渡部優衣",
      "source": "https://umamusume.jp/character/winningticket"
    },
    {
      "characterId": "air-shakur",
      "officialId": "airshakur",
      "kind": "main",
      "nameJa": "エアシャカール",
      "nameEn": "Air Shakur",
      "voiceJa": "津田美波",
      "source": "https://umamusume.jp/character/airshakur"
    },
    {
      "characterId": "eishin-flash",
      "officialId": "eishinflash",
      "kind": "main",
      "nameJa": "エイシンフラッシュ",
      "nameEn": "Eishin Flash",
      "voiceJa": "藤野彩水",
      "source": "https://umamusume.jp/character/eishinflash"
    },
    {
      "characterId": "curren-chan",
      "officialId": "currenchan",
      "kind": "main",
      "nameJa": "カレンチャン",
      "nameEn": "Curren Chan",
      "voiceJa": "篠原侑",
      "source": "https://umamusume.jp/character/currenchan"
    },
    {
      "characterId": "kawakami-princess",
      "officialId": "kawakamiprincess",
      "kind": "main",
      "nameJa": "カワカミプリンセス",
      "nameEn": "Kawakami Princess",
      "voiceJa": "高橋花林",
      "source": "https://umamusume.jp/character/kawakamiprincess"
    },
    {
      "characterId": "gold-city",